{
  "schema": "bjorn-vectors/expected-outcome/v0",
  "status": "DESIGN CANDIDATE / PROPOSED, NOT EXECUTED",
  "case_id": "B2-f",
  "family": "B2",
  "frozen_before_any_run": true,
  "integrity": {"predicate": "signature, chain and visible-log consistency of the presented records", "status": "verified", "visible_log": "consistent", "rules": ["R1"], "provenance": "echo of the declared stage-1 input; reported separately from mediation and bypass conclusions"},
  "observation_assessment": [
    {"surface": "gw-http", "adequate": [{"start": "2026-01-01T02:00:00Z", "end": "2026-01-01T03:00:00Z"}], "inadequate": []},
    {"surface": "alt-db", "adequate": [{"start": "2026-01-01T02:00:00Z", "end": "2026-01-01T03:00:00Z"}], "inadequate": []}
  ],
  "mediation_assessment": [{"surface": "gw-http", "status": "absent", "rules": ["R13"]}, {"surface": "alt-db", "status": "absent", "rules": ["R13"]}],
  "findings": [],
  "claim_results": [
    {"claim": "no_bypass", "polarity": "every effect on a required surface in the scope took a mediated route", "scope": {"surfaces": ["gw-http", "alt-db"], "interval": {"start": "2026-01-01T02:00:00Z", "end": "2026-01-01T03:00:00Z"}}, "status": "not_established", "rules": ["R8", "R13"], "evidence": ["both surfaces adequately observed", "no mediation-binding evidence; matching effect_refs do not establish mediation"], "conditional_on": []},
    {"claim": "bypass_occurred", "polarity": "at least one effect on a required surface in the scope took a non-mediated route", "scope": {"surfaces": ["gw-http", "alt-db"], "interval": {"start": "2026-01-01T02:00:00Z", "end": "2026-01-01T03:00:00Z"}}, "status": "not_established", "rules": ["R11", "R13"], "evidence": ["routes of all observed effects are undetermined"], "conditional_on": []}
  ],
  "scoped_results": [],
  "unestablished": [{"scope": {"surfaces": ["gw-http", "alt-db"], "interval": {"start": "2026-01-01T02:00:00Z", "end": "2026-01-01T03:00:00Z"}}, "affected_claims": ["no_bypass", "bypass_occurred"]}],
  "must_not_conclude": ["no_bypass supported because every observed effect_ref matches a record", "no_bypass supported because observation is complete", "bypass_occurred supported"],
  "pr182_mapping": "Record correspondence holds for every observed effect, but without mediation binding no 7.1.1-style completeness basis is established for either surface."
}
