{
  "schema": "bjorn-vectors/expected-outcome/v0",
  "status": "DESIGN CANDIDATE / PROPOSED, NOT EXECUTED",
  "case_id": "B1-b",
  "family": "B1",
  "frozen_before_any_run": true,
  "integrity": {"predicate": "per-epoch signature, chain and sequence integrity of the presented records", "per_epoch": [{"epoch_id": "src-1/e1", "status": "verified"}, {"epoch_id": "src-1/e2", "status": "verified"}], "rules": ["R1", "R2"], "provenance": "echo of the declared stage-1 input; reported separately and never used to decide completeness"},
  "cross_epoch": {"discontinuity": "restart_counter_reset", "from_epoch": "src-1/e1", "to_epoch": "src-1/e2", "link": "verified", "link_record_id": "L-5f30", "note": "the link connects the record chains; cross-epoch completeness is assessed only from population evidence (R3)"},
  "basis_assessment": {"kind": "epoch_link_evidence", "evidence_id": "EL-1", "status": "not_population_evidence", "rules": ["R3"]},
  "reconciliation": null,
  "findings": [],
  "claim_results": [
    {"claim": "coverage_complete", "polarity": "every evidence obligation of src-1 due in the interval is met by exactly one record", "scope": {"instance_id": "src-1", "interval": {"start": "2026-01-01T00:00:00Z", "end": "2026-01-01T01:00:00Z"}}, "status": "not_established", "rules": ["R3", "R6"], "evidence": ["EL-1 links src-1/e1 to src-1/e2", "an epoch link is not population evidence"], "conditional_on": []}
  ],
  "scoped_results": [],
  "unestablished": [{"scope": {"instance_id": "src-1", "interval": {"start": "2026-01-01T00:00:00Z", "end": "2026-01-01T01:00:00Z"}}, "affected_claims": ["coverage_complete"]}],
  "must_not_conclude": ["epoch link implies population completeness", "coverage_complete supported", "a withheld event named, counted or dated"],
  "pr182_mapping": "PR182 names no epoch-link basis; an epoch link is not a population completeness basis. Completeness is not established; C1 is not demonstrated."
}
