{
  "schema": "bjorn-vectors/expected-outcome/v0",
  "status": "DESIGN CANDIDATE / PROPOSED, NOT EXECUTED",
  "case_id": "B2-b",
  "family": "B2",
  "frozen_before_any_run": true,
  "integrity": {"predicate": "signature, chain and visible-log consistency of the presented records", "status": "verified", "visible_log": "consistent", "rules": ["R1"], "provenance": "echo of the declared stage-1 input; reported separately from mediation and bypass conclusions"},
  "observation_assessment": [
    {"surface": "gw-http", "adequate": [{"start": "2026-01-01T02:00:00Z", "end": "2026-01-01T03:00:00Z"}], "inadequate": []},
    {"surface": "alt-db", "adequate": [], "inadequate": [{"start": "2026-01-01T02:00:00Z", "end": "2026-01-01T03:00:00Z", "reason": "available_incomplete"}]}
  ],
  "mediation_assessment": [{"surface": "gw-http", "evidence_id": "MB-http", "status": "bound", "rules": ["R8"]}, {"surface": "alt-db", "evidence_id": "MB-db", "status": "bound", "rules": ["R8"]}],
  "findings": [],
  "claim_results": [
    {"claim": "no_bypass", "polarity": "every effect on a required surface in the scope took a mediated route", "scope": {"surfaces": ["gw-http", "alt-db"], "interval": {"start": "2026-01-01T02:00:00Z", "end": "2026-01-01T03:00:00Z"}}, "status": "not_established", "rules": ["R8", "R9"], "evidence": ["alt-db observation is a sample; unsampled writes cannot be counted"], "conditional_on": []},
    {"claim": "bypass_occurred", "polarity": "at least one effect on a required surface in the scope took a non-mediated route", "scope": {"surfaces": ["gw-http", "alt-db"], "interval": {"start": "2026-01-01T02:00:00Z", "end": "2026-01-01T03:00:00Z"}}, "status": "not_established", "rules": ["R9", "R11"], "evidence": ["no witnessed non-mediated route", "alt-db observation is a sample"], "conditional_on": []}
  ],
  "scoped_results": [],
  "unestablished": [{"scope": {"surfaces": ["alt-db"], "interval": {"start": "2026-01-01T02:00:00Z", "end": "2026-01-01T03:00:00Z"}}, "affected_claims": ["no_bypass", "bypass_occurred"]}],
  "must_not_conclude": ["no_bypass supported", "bypass_occurred supported", "no sampled write treated as no write"],
  "pr182_mapping": "A sampled observation is not a completeness basis (PR182 S requires a stated basis); population completeness is not established."
}
