{
  "schema": "bjorn-vectors/expected-outcome/v0",
  "status": "DESIGN CANDIDATE / PROPOSED, NOT EXECUTED",
  "case_id": "B2-d1",
  "family": "B2",
  "frozen_before_any_run": true,
  "integrity": {"predicate": "signature, chain and visible-log consistency of the presented records", "status": "verified", "visible_log": "consistent", "rules": ["R1"], "provenance": "echo of the declared stage-1 input; reported separately from mediation and bypass conclusions"},
  "observation_assessment": [
    {"surface": "gw-http", "adequate": [{"start": "2026-01-01T02:00:00Z", "end": "2026-01-01T03:00:00Z"}], "inadequate": []},
    {"surface": "alt-db", "adequate": [{"start": "2026-01-01T02:00:00Z", "end": "2026-01-01T03:00:00Z"}], "inadequate": []}
  ],
  "mediation_assessment": [{"surface": "gw-http", "evidence_id": "MB-http", "status": "bound", "rules": ["R8"]}, {"surface": "alt-db", "evidence_id": "MB-db", "status": "bound", "rules": ["R8"]}],
  "findings": [
    {"type": "unrecorded_effect", "effect_id": "E-77", "surface": "alt-db", "time": "2026-01-01T02:30:00Z", "evidence": "OB-db observed E-77 with effect_ref X-99; no record carries X-99", "rules": ["R10"]},
    {"type": "non_mediated_route", "effect_id": "E-77", "surface": "alt-db", "time": "2026-01-01T02:30:00Z", "evidence": "route svc-batch of E-77 is not a mediated route under MB-db", "rules": ["R11"]}
  ],
  "claim_results": [
    {"claim": "no_bypass", "polarity": "every effect on a required surface in the scope took a mediated route", "scope": {"surfaces": ["gw-http", "alt-db"], "interval": {"start": "2026-01-01T02:00:00Z", "end": "2026-01-01T03:00:00Z"}}, "status": "not_supported", "rules": ["R11"], "evidence": ["witnessed effect E-77 took non-mediated route svc-batch"], "conditional_on": ["A4", "A6", "A9"]},
    {"claim": "bypass_occurred", "polarity": "at least one effect on a required surface in the scope took a non-mediated route", "scope": {"surfaces": ["gw-http", "alt-db"], "interval": {"start": "2026-01-01T02:00:00Z", "end": "2026-01-01T03:00:00Z"}}, "status": "supported", "rules": ["R11", "R12"], "evidence": ["witnessed effect E-77 took non-mediated route svc-batch"], "conditional_on": ["A4", "A6", "A9"]}
  ],
  "scoped_results": [],
  "unestablished": [],
  "must_not_conclude": ["integrity success offsets the witnessed bypass", "bypass stated without its route assumption A6", "the unrecorded_effect finding alone treated as proof of bypass"],
  "pr182_mapping": "Under A4, A6 and A9 an in-scope action outside the identified population is witnessed, so the 7.1.1-style completeness basis fails. unrecorded_effect is a local correspondence finding, not the PR182 unmatched record."
}
