{
  "schema": "bjorn-vectors/expected-outcome/v0",
  "status": "DESIGN CANDIDATE / PROPOSED, NOT EXECUTED",
  "case_id": "B2-g",
  "family": "B2",
  "frozen_before_any_run": true,
  "integrity": {"predicate": "signature, chain and visible-log consistency of the presented records", "status": "verified", "visible_log": "consistent", "rules": ["R1"], "provenance": "echo of the declared stage-1 input; reported separately from mediation and bypass conclusions"},
  "observation_assessment": [
    {"surface": "gw-http", "adequate": [{"start": "2026-01-01T02:00:00Z", "end": "2026-01-01T03:00:00Z"}], "inadequate": []},
    {"surface": "alt-db", "adequate": [], "inadequate": [{"start": "2026-01-01T02:00:00Z", "end": "2026-01-01T03:00:00Z", "reason": "available_incomplete"}]}
  ],
  "mediation_assessment": [{"surface": "gw-http", "evidence_id": "MB-http", "status": "bound", "rules": ["R8"]}, {"surface": "alt-db", "evidence_id": "MB-db", "status": "bound", "rules": ["R8"]}],
  "findings": [
    {"type": "unrecorded_effect", "effect_id": "E-78", "surface": "alt-db", "time": "2026-01-01T02:30:00Z", "evidence": "sampled entry E-78 has effect_ref X-99; no record carries X-99", "rules": ["R10"]},
    {"type": "non_mediated_route", "effect_id": "E-78", "surface": "alt-db", "time": "2026-01-01T02:30:00Z", "evidence": "route svc-batch of E-78 is not a mediated route under MB-db", "rules": ["R11"]}
  ],
  "claim_results": [
    {"claim": "no_bypass", "polarity": "every effect on a required surface in the scope took a mediated route", "scope": {"surfaces": ["gw-http", "alt-db"], "interval": {"start": "2026-01-01T02:00:00Z", "end": "2026-01-01T03:00:00Z"}}, "status": "not_supported", "rules": ["R9", "R11"], "evidence": ["witnessed sampled effect E-78 took non-mediated route svc-batch; incomplete observation does not erase it"], "conditional_on": ["A6", "A9", "A10"]},
    {"claim": "bypass_occurred", "polarity": "at least one effect on a required surface in the scope took a non-mediated route", "scope": {"surfaces": ["gw-http", "alt-db"], "interval": {"start": "2026-01-01T02:00:00Z", "end": "2026-01-01T03:00:00Z"}}, "status": "supported", "rules": ["R9", "R11", "R12"], "evidence": ["witnessed sampled effect E-78 took non-mediated route svc-batch"], "conditional_on": ["A6", "A9", "A10"]}
  ],
  "scoped_results": [],
  "unestablished": [],
  "must_not_conclude": ["both claims not_established merely because alt-db observation is incomplete", "the number of bypasses inferred from the sample", "no_bypass supported for unsampled writes"],
  "pr182_mapping": "A single witnessed out-of-population action defeats the 7.1.1-style completeness basis even though alt-db observation is incomplete; completeness of the rest of alt-db remains unestablished."
}
